<?xml version="1.0" encoding="utf-8"?>
<GSKDocument DtdVersion="5" DtdRelease="0" xmlns:xsi="http://www.w3.org/2001/XMLSchema-instance" xsi:noNamespaceSchemaLocation="gsk-document.xsd">
    <DocumentIdentification v="testGlsk"/>
    <DocumentVersion v="1"/>
    <DocumentType v="Z02"/>
    <ProcessType v="Z02"/>
    <SenderIdentification v="XXXXXXXXXXXXXXXX" codingScheme="A01"/>
    <SenderRole v="A36"/>
    <ReceiverIdentification v="XXXXXXXXXXXXXXXX" codingScheme="A01"/>
    <ReceiverRole v="A04"/>
    <CreationDateTime v="2020-09-15T17:59:09Z"/>
    <GSKTimeInterval v="2020-09-16T22:00Z/2020-09-16T23:00Z"/>
    <Domain v="10YDOM-1001A061T" codingScheme="A01"/>
    <TimeSeries>
        <TimeSeriesIdentification v="1"/>
        <BusinessType v="Z02"/>
        <Area v="10YCH-SWISSGRIDZ" codingScheme="A01" />
        <Name v="CH" />
        <TimeInterval v="2020-09-16T22:00Z/2020-09-16T22:59Z"/>
        <PropGSKBlock>
            <Order>1</Order>
            <MaximumShift v="1000" />
<!--            <Factor v="1"/>-->
            <Node>
                <Name v="FFR1AA1 "/>
            </Node>
            <Node>
                <Name v="FFR2AA1 "/>
            </Node>
        </PropGSKBlock>
        <ReserveGSKBlock>
            <Order>2</Order>
<!--            <Factor v="1"/>-->
            <Node>
                <Name v="FFR3AA1 "/>
                <Pmin v="0"/>
                <Pmax v="-5000"/>
            </Node>
        </ReserveGSKBlock>
    </TimeSeries>
    <TimeSeries>
        <TimeSeriesIdentification v="1"/>
        <BusinessType v="Z02"/>
        <Area v="FR_MANUAL" codingScheme="A01"/>
        <Name v="FR_MANUAL"/>
        <TimeInterval v="2020-09-16T22:00Z/2020-09-16T22:59Z"/>
        <ManualGSKBlock>
            <Factor v="1"/>
            <Node>
                <Name v="FFR1AA1 "/>
                <Factor v="70"/>
            </Node>
            <Node>
                <Name v="FFR3AA1 "/>
                <Factor v="30"/>
            </Node>
        </ManualGSKBlock>
    </TimeSeries>
</GSKDocument>
