<?xml version="1.0" encoding="utf-8"?>
<GSKDocument DtdVersion="5" DtdRelease="0" xmlns:xsi="http://www.w3.org/2001/XMLSchema-instance" xsi:noNamespaceSchemaLocation="gsk-document.xsd">
    <DocumentIdentification v="testGlsk"/>
    <DocumentVersion v="1"/>
    <DocumentType v="Z02"/>
    <ProcessType v="Z02"/>
    <SenderIdentification v="10VCSEEH4MMD-NDO" codingScheme="A01"/>
    <SenderRole v="A36"/>
    <ReceiverIdentification v="10X1001A1001A345" codingScheme="A01"/>
    <ReceiverRole v="A04"/>
    <CreationDateTime v="2020-09-15T17:59:09Z"/>
    <GSKTimeInterval v="2020-09-16T22:00Z/2020-09-16T23:00Z"/>
    <Domain v="10YDOM-1001A061T" codingScheme="A01"/>
    <TimeSeries>
        <TimeSeriesIdentification v="1"/>
        <BusinessType v="Z02"/>
        <Area v="FR_MANUAL" codingScheme="A01"/>
        <Name v="FR_MANUAL"/>
        <TimeInterval v="2020-09-16T22:00Z/2020-09-16T22:59Z"/>
        <ManualGSKBlock>
            <Factor v="1"/>
            <Node>
                <Name v="FFR1AA1 "/>
                <Factor v="70"/>
            </Node>
            <Node>
                <Name v="FFR3AA1 "/>
                <Factor v="30"/>
            </Node>
        </ManualGSKBlock>
    </TimeSeries>
    <TimeSeries>
        <TimeSeriesIdentification v="1"/>
        <BusinessType v="Z02"/>
        <Area v="FR_PROPGSK" codingScheme="A01"/>
        <Name v="FR_PROPGSK"/>
        <TimeInterval v="2020-09-16T22:00Z/2020-09-16T22:59Z"/>
        <PropGSKBlock>
            <Factor v="1"/>
            <Node>
                <Name v="FFR1AA1 "/>
            </Node>
            <Node>
                <Name v="FFR2AA1 "/>
            </Node>
            <Node>
                <Name v="FFR3AA1 "/>
            </Node>
        </PropGSKBlock>
    </TimeSeries>
    <TimeSeries>
        <TimeSeriesIdentification v="1"/>
        <BusinessType v="Z02"/>
        <Area v="FR_PROPGLSK" codingScheme="A01"/>
        <Name v="FR_PROPGLSK"/>
        <TimeInterval v="2020-09-16T22:00Z/2020-09-16T22:59Z"/>
        <PropGSKBlock>
            <Factor v="0.7"/>
            <Node>
                <Name v="FFR1AA1 "/>
            </Node>
            <Node>
                <Name v="FFR2AA1 "/>
            </Node>
            <Node>
                <Name v="FFR3AA1 "/>
            </Node>
        </PropGSKBlock>
        <PropLSKBlock>
            <Factor v="0.3"/>
            <Node>
                <Name v="FFR1AA1 "/>
            </Node>
            <Node>
                <Name v="FFR2AA1 "/>
            </Node>
        </PropLSKBlock>
    </TimeSeries>
</GSKDocument>
